[
  {
    "id": "stone_tools",
    "name": "Stone Tools",
    "age": 0,
    "cost": { "food": 50 },
    "research_time": 25,
    "prerequisites": [],
    "effects": {
      "economic_bonus": { "gather_rate": 0.10 },
      "unlock_buildings": ["mining_camp"]
    },
    "description": "Craft sharpened flint into axes, scrapers, and blades. Unlocks the Mining Camp and improves villager gathering efficiency across all resources.",
    "flavor_text": "Sharpened flint changes everything."
  },
  {
    "id": "fire_mastery",
    "name": "Fire Mastery",
    "age": 0,
    "cost": { "food": 75 },
    "research_time": 30,
    "prerequisites": [],
    "effects": {
      "economic_bonus": { "hunting_yield": 0.20 },
      "stat_modifiers": { "night_los": 2 }
    },
    "description": "Learn to create and control fire for cooking, warmth, and light. Increases hunting yield and extends night vision range.",
    "flavor_text": "Warmth, light, and cooked meat."
  },
  {
    "id": "animal_husbandry",
    "name": "Animal Husbandry",
    "age": 0,
    "cost": { "food": 100 },
    "research_time": 40,
    "prerequisites": ["stone_tools"],
    "effects": {
      "unlock_buildings": ["sheep_pen"]
    },
    "description": "Domesticate animals for a reliable food source. Unlocks the Sheep Pen building for sustainable meat and wool production.",
    "flavor_text": "The first step from hunter to herder."
  },
  {
    "id": "basket_weaving",
    "name": "Basket Weaving",
    "age": 0,
    "cost": { "food": 75, "wood": 25 },
    "research_time": 30,
    "prerequisites": ["stone_tools"],
    "effects": {
      "economic_bonus": { "carry_capacity": 0.25 }
    },
    "description": "Weave plant fibers into containers for transporting resources. Increases villager carry capacity by 25%.",
    "flavor_text": "Woven reeds multiply what hands can carry."
  },
  {
    "id": "agriculture",
    "name": "Agriculture",
    "age": 0,
    "cost": { "food": 50 },
    "research_time": 35,
    "prerequisites": [],
    "effects": {
      "economic_bonus": { "farm_food_rate": 0.25 },
      "unlock_buildings": ["farm"]
    },
    "description": "Cultivate crops instead of relying on foraging. Unlocks the Farm building and boosts farm food production rate by 25%, enabling population growth.",
    "flavor_text": "Planted seeds promise a future beyond foraging."
  },
  {
    "id": "bronze_working",
    "name": "Bronze Working",
    "age": 1,
    "cost": { "food": 150, "gold": 100 },
    "research_time": 45,
    "prerequisites": [],
    "effects": {
      "stat_modifiers": { "melee_attack": 1 },
      "unlock_buildings": ["barracks"],
      "unlock_units": ["infantry"]
    },
    "description": "Alloy copper and tin into bronze for weapons and tools. Unlocks the Barracks and Infantry units, and increases melee attack power.",
    "flavor_text": "Copper and tin forge an empire.",
    "pioneer_bonus": {
      "type": "temporary_buff",
      "effect": {
        "stat_modifier": { "melee_attack_multiplier": 0.15 }
      },
      "duration": 120,
      "follower_discount": 0.10,
      "notification": "{civ} has pioneered Bronze Working — their warriors wield weapons no stone can withstand.",
      "survives_knowledge_burning": true
    }
  },
  {
    "id": "writing",
    "name": "Writing",
    "age": 1,
    "cost": { "food": 100, "wood": 75 },
    "research_time": 50,
    "prerequisites": [],
    "effects": {
      "unlock_buildings": ["library"]
    },
    "description": "Develop a system of written symbols to record knowledge. Unlocks the Library, the foundation for all advanced research.",
    "flavor_text": "Marks on clay become the memory of a people.",
    "pioneer_bonus": {
      "type": "permanent_stat",
      "effect": {
        "research_queue_bonus": 1
      },
      "duration": null,
      "follower_discount": 0.10,
      "notification": "{civ} has pioneered Writing — their scribes preserve knowledge no memory can hold.",
      "survives_knowledge_burning": true
    }
  },
  {
    "id": "pottery",
    "name": "Pottery",
    "age": 1,
    "cost": { "food": 100, "wood": 50 },
    "research_time": 35,
    "prerequisites": [],
    "effects": {
      "economic_bonus": { "food_decay_reduction": 0.50 },
      "unlock_buildings": ["market"]
    },
    "description": "Shape and fire clay into durable vessels for storage and trade. Halves food decay and unlocks the Market building.",
    "flavor_text": "Fired clay stores grain through winter."
  },
  {
    "id": "irrigation",
    "name": "Irrigation",
    "age": 1,
    "cost": { "food": 200, "wood": 150 },
    "research_time": 60,
    "prerequisites": ["writing"],
    "effects": {
      "economic_bonus": { "farm_output": 0.25 }
    },
    "description": "Build canal systems to deliver water to farmland. Increases farm output by 25%, critical for sustaining larger populations.",
    "flavor_text": "Canals turn desert into garden."
  },
  {
    "id": "masonry",
    "name": "Masonry",
    "age": 1,
    "cost": { "wood": 150, "stone": 100 },
    "research_time": 50,
    "prerequisites": ["bronze_working"],
    "effects": {
      "stat_modifiers": { "building_hp": 0.20 },
      "unlock_buildings": ["stone_wall"]
    },
    "description": "Cut and fit stone blocks for durable construction. Increases building HP by 20% and unlocks Stone Walls for defense.",
    "flavor_text": "Fitted stone stands where mud brick crumbles."
  },
  {
    "id": "sailing",
    "name": "Sailing",
    "age": 1,
    "cost": { "wood": 200, "gold": 75 },
    "research_time": 55,
    "prerequisites": [],
    "effects": {
      "unlock_buildings": ["dock"],
      "unlock_units": ["fishing_boat", "merchant_ship", "transport_ship"]
    },
    "description": "Harness the wind to cross open water. Unlocks the Dock and naval units including Fishing Boats, Merchant Ships, and Transports.",
    "flavor_text": "The horizon beckons."
  },
  {
    "id": "gillnets",
    "name": "Gillnets",
    "age": 1,
    "cost": { "food": 150, "wood": 100 },
    "research_time": 45,
    "prerequisites": ["sailing"],
    "effects": {
      "stat_modifiers": { "fishing_carry": 5 }
    },
    "description": "Weave fine nets that trap fish by their gills. Increases Fishing Boat carry capacity, boosting food income from the sea.",
    "flavor_text": "Woven nets haul a richer catch."
  },
  {
    "id": "the_wheel",
    "name": "The Wheel",
    "age": 1,
    "cost": { "wood": 100, "stone": 50 },
    "research_time": 40,
    "prerequisites": ["agriculture"],
    "effects": {
      "stat_modifiers": { "unit_speed": 0.15 }
    },
    "description": "Mount axles on circular discs for carts and chariots. Increases all unit movement speed by 15%.",
    "flavor_text": "Round and round, the world moves faster."
  },
  {
    "id": "iron_working",
    "name": "Iron Working",
    "age": 2,
    "cost": { "food": 200, "gold": 150 },
    "research_time": 55,
    "prerequisites": ["bronze_working"],
    "effects": {
      "stat_modifiers": { "melee_attack": 2 },
      "unlock_units": ["swordsman"]
    },
    "description": "Smelt iron ore into stronger weapons and armor. Unlocks Swordsmen and significantly boosts melee attack across your army.",
    "flavor_text": "Iron edges shatter bronze shields."
  },
  {
    "id": "philosophy",
    "name": "Philosophy",
    "age": 2,
    "cost": { "gold": 150, "knowledge": 100 },
    "research_time": 60,
    "prerequisites": ["writing"],
    "effects": {
      "research_bonus": 0.25
    },
    "description": "Pursue systematic inquiry into the nature of knowledge and reality. Grants a 25% research speed bonus to all future technologies.",
    "flavor_text": "The unexamined life is not worth living."
  },
  {
    "id": "mathematics",
    "name": "Mathematics",
    "age": 2,
    "cost": { "gold": 200, "knowledge": 150 },
    "research_time": 65,
    "prerequisites": ["writing"],
    "effects": {
      "economic_bonus": { "construction_speed": 0.15 },
      "stat_modifiers": { "siege_accuracy": 0.10 }
    },
    "description": "Develop formal number systems, geometry, and calculation. Speeds up construction by 15% and improves siege weapon accuracy.",
    "flavor_text": "Numbers reveal the hidden order of things.",
    "pioneer_bonus": {
      "type": "permanent_stat",
      "effect": {
        "stat_modifier": { "research_cost_multiplier": -0.05 }
      },
      "duration": null,
      "follower_discount": 0.10,
      "notification": "{civ} has pioneered Mathematics — the language of the universe bends to their scholars.",
      "survives_knowledge_burning": true
    }
  },
  {
    "id": "currency",
    "name": "Currency",
    "age": 2,
    "cost": { "gold": 250 },
    "research_time": 50,
    "prerequisites": ["pottery"],
    "effects": {
      "economic_bonus": { "gold_income": 0.15 }
    },
    "description": "Mint standardized coins to replace barter trade. Increases gold income by 15%, fueling economic growth.",
    "flavor_text": "Standardized coins replace haggled barter."
  },
  {
    "id": "engineering",
    "name": "Engineering",
    "age": 2,
    "cost": { "wood": 200, "stone": 200, "knowledge": 100 },
    "research_time": 70,
    "prerequisites": ["mathematics"],
    "effects": {
      "unlock_buildings": ["siege_workshop", "aqueduct"],
      "economic_bonus": { "house_capacity": 5 }
    },
    "description": "Apply mathematical principles to practical construction. Unlocks the Siege Workshop and Aqueduct, and increases housing capacity.",
    "flavor_text": "Theory meets stone and timber."
  },
  {
    "id": "code_of_laws",
    "name": "Code of Laws",
    "age": 2,
    "cost": { "gold": 200, "knowledge": 150 },
    "research_time": 60,
    "prerequisites": ["writing"],
    "effects": {
      "corruption_reduction": 0.30,
      "economic_bonus": { "villager_efficiency": 0.10 }
    },
    "description": "Codify rules governing society to reduce corruption and improve order. Cuts corruption by 30% and boosts villager efficiency.",